{
  "dataset_version": "0.2.0-preview",
  "seed": 20260923,
  "generator_version": "0.2.1",
  "case_count": 6629,
  "event_count": 48851,
  "files": [
    {
      "path": "datasets/golden/curated.jsonl",
      "sha256": "5736b506cf3a00602936ea9af284dbe8bce97c5c7ee17a5f8f915c1771699973",
      "case_count": 210,
      "event_count": 370,
      "bytes": 188035
    },
    {
      "path": "datasets/golden/template_derived.jsonl",
      "sha256": "a7ca2b3f0b1babfd5a812bcf31d40b6aad313b2f58e73da0e0b78d48e0c278f8",
      "case_count": 230,
      "event_count": 244,
      "bytes": 127060
    },
    {
      "path": "datasets/synthetic/cases.jsonl",
      "sha256": "a4b6409e428c109b2ea2374d3f0ffaec51d7c6e29eb216c945340dab993eb67d",
      "case_count": 5000,
      "event_count": 45179,
      "bytes": 11270590
    },
    {
      "path": "datasets/adversarial/cases.jsonl",
      "sha256": "84c735a9fd84043015d64a7329601d5be4b69754c4360bb96d23692af6cfe87d",
      "case_count": 1189,
      "event_count": 3058,
      "bytes": 3188348
    }
  ],
  "sha256": "242a593739e55a02f305ffce0350425b04d5aad0ef1781d0a4190ab67195fcdf"
}
